,Industry,Date,StartupName,IndustryVertical,SubVertical,CityLocation,InvestorsName,InvestmentType,AmountInUSD
0,Industry,1/8/2017,TouchKin,Others,Predictive Care Platform,Bangalore,Kae Capital,Private Equity,1300000.0
1,Industry,2/8/2017,Ethinos,Others,Digital Marketing Agency,Mumbai,Triton Investment Advisors,Private Equity,1070000.0
2,Industry,2/8/2017,Leverage Edu,Consumer Internet,Online platform for Higher Education Services,New Delhi,"Kashyap Deorah, Anand Sankeshwar, Deepak Jain, Sadashiva NT, Arjun Mehta, Satish Kaul, Anindya Ghose",Seed Funding,1070000.0
3,Industry,2/8/2017,Zepo,Consumer Internet,DIY Ecommerce platform,Mumbai,"Kunal Shah, LetsVenture, Anupam Mittal, Hetal Sonpal",Seed Funding,500000.0
4,Industry,2/8/2017,Click2Clinic,Consumer Internet,healthcare service aggregator,Hyderabad,"Narottam Thudi, Shireesh Palle",Seed Funding,850000.0
5,Industry,1/7/2017,Billion Loans,Consumer Internet,Peer to Peer Lending platform,Bangalore,Reliance Corporate Advisory Services Ltd,Seed Funding,1000000.0
6,Industry,3/7/2017,Ecolibriumenergy,Others,Energy management solutions provider,Ahmedabad,"Infuse Ventures, JLL",Private Equity,2600000.0
7,Industry,4/7/2017,Droom,eCommerce,Online marketplace for automobiles,Gurgaon,"Asset Management (Asia) Ltd, Digital Garage Inc",Private Equity,20000000.0
8,Industry,5/7/2017,Jumbotail,eCommerce,online marketplace for food and grocery,Bangalore,"Kalaari Capital, Nexus India Capital Advisors",Private Equity,8500000.0
9,Industry,5/7/2017,Moglix,eCommerce,B2B marketplace for Industrial products,Noida,"International Finance Corporation, Rocketship, Accel Partners, Jungle Ventures, Shailesh Rao, Venture Highway",Private Equity,12000000.0
10,Industry,5/7/2017,Timesaverz,Consumer Internet,Hyperlocal home services provider,Mumbai,BCCL,Private Equity,1000000.0
11,Industry,6/7/2017,Minjar,Others,Cloud Solutions provider,Bangalore,"Blume Ventures, Contrarian Capital India Partners, Emergent Ventures India, Pallav Nadhani, Ashish Gupta, Sharad Sharma, Sirion Labs",Seed Funding,1070000.0
12,Industry,6/7/2017,MyCity4kids,Consumer Internet,parenting blog and kids’ events discovery platform,Gurgaon,,Seed Funding,1070000.0
13,Industry,7/7/2017,Clip App,Consumer Internet,Digital Media Video platform,Bangalore,"India Quotient, Shunwei Capital",Seed Funding,1000000.0
14,Industry,7/7/2017,Upwardly.in,Consumer Internet,MF investment platform,Bangalore,"Sreeram Iyer, Suvo Sarkar, Anita Gupta, Likemind Ventures",Seed Funding,1070000.0
15,Industry,10/7/2017,Autorox.co,Others,Workshop Management Software Platform,Hyderabad,Mitsui & Co.,Private Equity,3000000.0
16,Industry,11/7/2017,Fabogo,Consumer Internet,Salon & Spa Aggregation & Discovery platform,Pune,Dunamis Ventures Pte Ltd,Private Equity,2250000.0
17,Industry,11/7/2017,Flickstree,Consumer Internet,Video Content Discovery Platform,Mumbai,"Venture Catalysts, Sourav Ganguly, Ankit Aditya, Moksh Sports Ventures",Seed Funding,464000.0
18,Industry,11/7/2017,Design Cafe,Consumer Internet,Online Interior Design platform,Bangalore,"Fireside Ventures, Apurva Salarpuria, Sidharth Pansari, Sprout Capital",Seed Funding,1070000.0
19,Industry,12/7/2017,Innoviti,Others,Digital payments solutions,Bangalore,"SBI-FMO Fund, Bessemer Venture Partners, Catamaran Ventures",Private Equity,18500000.0
20,Industry,12/7/2017,VDeliver,Others,Door Step Delivery platform,Hyderabad,"Corvus Ventures, MAPE Advisory Group",Private Equity,1070000.0
21,Industry,12/7/2017,Bottr.me,Others,Chatbot creation tool,Bangalore,"500 Startups, Purvi Capital, Rajan Anandan, Abhishek Gupta",Seed Funding,1070000.0
22,Industry,12/7/2017,Arcatron,Others,Next Gen Mobility device manufacturer,Pune,Indian Angel Network,Seed Funding,1070000.0
23,Industry,14/07/2017,QwikSpec,Others,Construction site operations and analytics platform,Bangalore,"Brigade Innovations LLP, TV Mohandas Pai, Suhail Rahman, Bobby Reddy, M George Oommen",Seed Funding,540000.0
24,Industry,14/07/2017,Chumbak,eCommerce,Designer consumer products Marketplace,Bangalore,Blacksoil Capital Pvt. Ltd,Private Equity,1700000.0
25,Industry,17/07/2017,Increff,Others,Sales Solutions for Fashion Brands,Bangalore,"Sequoia Capital, Grey Orange, Rajesh Ramaiah, Anshuman Das, Rishi Das",Seed Funding,2000000.0
26,Industry,17/07/2017,Vayana,Others,Enterprise Banking Solutions,Pune,"IDG Ventures India Advisors, Jungle Ventures",Private Equity,4000000.0
27,Industry,18/07/2017,MObiquest,Others,Mobile Services & Solutions,Noida,One97 Communication Ltd,Private Equity,1070000.0
28,Industry,18/07/2017,Ambee,Consumer Internet,Ambulance Aggregation Services,Hyderabad,"Uber Technologies Inc, Amaya Capital LLP",Seed Funding,1070000.0
29,Industry,18/07/2017,Ideal Insurance,Consumer Internet,Online Insurance platform,Kolkata,Xelpmoc,Seed Funding,1070000.0
30,Industry,18/07/2017,Hypernova Interactive,Others,Mobile games creator,Bangalore,Kae Capital,Seed Funding,1070000.0
31,Industry,19/07/2017,Rentomojo,Consumer Internet,Consumer Leasing Platform,Bangalore,"ain Capital Ventures, Renaud Laplanche",Private Equity,10000000.0
32,Industry,19/07/2017,AirCTO,Consumer Internet,AI powered recruitment platform,Bangalore,Francesco Cara,Seed Funding,1070000.0
33,Industry,19/07/2017,Playablo,Others,Gamified Learning App,Bangalore,ABI-Showatech (India) Ltd,Seed Funding,600000.0
34,Industry,20/07/2017,Trupay,Others,Online payments platform,Gurgaon,"Kae Capital, M&S Partners,",Seed Funding,700000.0
35,Industry,21/07/2017,Brick2Wall,eCommerce,Online Marketplace for Construction Material,Gurgaon,"Subramani Somasundaram, Sundeep Sahni, Mayank Mittal & Others",Seed Funding,200000.0
36,Industry,21/07/2017,FableStreet,eCommerce,Women Work wear etailer,New Delhi,"Harmeet Bajaj, Pameela P, Fusiontech Ventures & Others",Seed Funding,1070000.0
37,Industry,21/07/2017,Monsoon Fintech,Others,Machine Learning Access platform,New Delhi,"Sunil Kalra, Aditya Singh, Rishi Srivastava, Rajan Anandan",Seed Funding,1070000.0
38,Industry,21/07/2017,MonkeyBox,Consumer Internet,Healthy Food Delivery Platform,Bangalore,"Blume Ventures, NB Ventures, Nspira",Seed Funding,1070000.0
39,Industry,25/07/2017,Noticeboard,Consumer Internet,Mobile-first Enterprise communication platform,Bangalore,"Stellaris Venture Partners,",Private Equity,1200000.0
40,Industry,25/07/2017,Byju’s,Consumer Internet,Mobile Learning App,Bangalore,Tencent Holdings,Private Equity,35000000.0
41,Industry,26/07/2017,Creator’s Gurukul,Others,Co-Working Space Provider,New Delhi,Yuvraj Singh,Seed Funding,1070000.0
42,Industry,26/07/2017,Fab Hotels,Consumer Internet,Budget hotels brand & Aggregator Platform,New Delhi,Goldman Sachs,Private Equity,25000000.0
43,Industry,26/07/2017,ThinkerBell,Consumer Internet,Assisted Learning Startup,Bangalore,"Indian Angel Network, Anand Mahindra",Seed Funding,200000.0
44,Industry,27/07/2017,1mg,eCommerce,Online Pharmacy,Gurgaon,"HBM Healthcare Investments, Maverick Capital Ventures, Sequoia India, Omidyar Network and Kae Capital",Private Equity,15000000.0
45,Industry,28/07/2017,Jhakaas,Consumer Internet,App-based Aggregator of Offline Businesses,Mumbai,Amen Dhyllon,Seed Funding,1070000.0
46,Industry,28/07/2017,BigStylist,Consumer Internet,Beauty Services Marketplace,Mumbai,Info Edge (India) Ltd,Private Equity,1250000.0
47,Industry,28/07/2017,Gympik.com,Consumer Internet,online marketplace for discovering fitness centres,bangalore,RoundGlass Partners,Seed Funding,1070000.0
48,Industry,1/6/2017,Tripeur,Others,Mobile based travel ERP platform,Bangalore,"Grace Grace Techno Ventures LLP, Rajul Garg & Other undisclosed investors",Seed Funding,1070000.0
49,Industry,2/6/2017,RentOnGo,eCommerce,"Online Marketplace for Renting Bikes, Electronics & Appliances",Bangalore,TVS Motor Company,Private Equity,1070000.0
50,Industry,5/6/2017,Goomo,Consumer Internet,Online Travel & Holiday Booking platform,Mumbai,Emerging India,Private Equity,50000000.0
51,Industry,5/6/2017,MaxMyWealth,Consumer Internet,Online Wealth Management & Savings platform,Mumbai,"blockchain ecosystem Global Advisors, Horseferry",Private Equity,1070000.0
52,Industry,6/6/2017,Spinny,eCommerce,Online Used Car marketplace,Gurgaon,"Blume Ventures, Indian Angel Network, Kunal Shah, Sandeep Tandon",Private Equity,1000000.0
53,Industry,6/6/2017,Healthbuds,Consumer Internet,Healthcare Discovery & booking platform,Kolkata,"Arun Patodia, Bharat Kedia",Seed Funding,1070000.0
54,Industry,6/6/2017,Ftcash,Consumer Internet,Mobile Payments platform,Mumbai,"500 Startups, IvyCap Ventures",Private Equity,1070000.0
55,Industry,6/6/2017,BHIVE Workspace,Consumer Internet,co-working spaces,Bangalore,Blume Ventures,Private Equity,1200000.0
56,Industry,6/6/2017,wayForward,Consumer Internet,Mobile app for Mental Health,New Delhi,"Harsh Mahajan, Farhan Naqvi, Sreepathy Viswanathan",Seed Funding,1000000.0
57,Industry,6/6/2017,GyanDhan,Consumer Internet,Education Marketplace,New Delhi,Sundaram Finance Holdings,Private Equity,1070000.0
58,Industry,6/6/2017,Hungry Foal,Consumer Internet,For profit Social Venture,Gurgaon,SBI (Stand Up India Scheme),Private Equity,1070000.0
59,Industry,7/6/2017,ZipLoan,Consumer Internet,Online lending platform,New Delhi,WaterBridge Ventures,Seed Funding,650000.0
60,Industry,7/6/2017,GrowFitter,Consumer Internet,health and fitness discovery platform,Mumbai,SQue Capital,Seed Funding,600000.0
61,Industry,8/6/2017,Stratfit,Consumer Internet,Health coaching programs,Hyderabad,Bodhtree Consulting Limited,Seed Funding,232000.0
62,Industry,8/6/2017,Multiplier Solutions,Others,CRM Software for Healthcare space,Hyderabad,Norwest Venture Partners,Private Equity,1500000.0
63,Industry,8/6/2017,ABI Health,Others,Unified Digital Health Platform,Bangalore,Norwest Venture Partners,Private Equity,1500000.0
64,Industry,8/6/2017,Stockal,Consumer Internet,App-based Investment advisory Services,Bangalore,"Mohan Alexander, R. Natarajan, Vikrant Varshney, Amit Sinha",Seed Funding,350000.0
65,Industry,9/6/2017,Guidoo,Consumer Internet,Travel & adventure planning platform,Mumbai,"Pawan Borle, Nirmal Singh, Manish Prasad, Vineet Varma, Nick Haulkoury, Abhai S. Rao",Seed Funding,300000.0
66,Industry,9/6/2017,eSahai.in,Consumer Internet,ambulance aggregator and medical taxi provider,Hyderabad,"Dr Ramesh Ayyala, Satya Muthyala",Seed Funding,250000.0
67,Industry,12/6/2017,Loanmeet,Consumer Internet,Online peer-to-peer lending platform,Bangalore,"Cao Yibin, Huang Wei, Madhusudan E,",Seed Funding,1070000.0
68,Industry,12/6/2017,LendingKart,Consumer Internet,Online Lending platform,Ahmedabad,Yes Bank,Debt Funding,7800000.0
69,Industry,12/6/2017,Boxx.ai,Others,Artificial Intelligence,Bangalore,"Unicorn India Ventures, Venky Krishnakumar, Suresh Shankar, Vivek Bhargava",Private Equity,500000.0
70,Industry,12/6/2017,PeeSafe.in,Healthcare,Hygiene care product manufacturer,New Delhi,"Venture Catalysts, Alfa Capital, Green Shots Capital, Real Time Ventures",Private Equity,1000000.0
71,Industry,12/6/2017,Vista Rooms,Consumer Internet,Online rooms aggregation platform,Mumbai,"Artha India Ventures, Singularity Holdings, Rajan Anandan, Girish Mathrubootham",Seed Funding,776000.0
72,Industry,12/6/2017,CoverFox,Consumer Internet,Online insurance brokerage platform,Mumbai,Transamerica,Private Equity,15000000.0
73,Industry,13/06/2017,HyperTrack,Others,Location tracking solutions,New Delhi,"Nexus Venture Partners, Founders Fund",Private Equity,1070000.0
74,Industry,13/06/2017,Goodera,Others,CSR and sustainability management platform,Bangalore,"Nexus Venture Partners, Omidyar Network",Private Equity,5500000.0
75,Industry,13/06/2017,Digit,Others,Tech driven Insurance platform,Bangalore,Fairfax Holdings,Private Equity,1070000.0
76,Industry,14/06/2017,Ola,Consumer Internet,Cab Aggregation App,Bangalore,Tekne Capital Management LLC,Private Equity,50000000.0
77,Industry,14/06/2017,Vanitycask,Consumer Internet,Beauty products discovery platform,Mumbai,RB Investments,Seed Funding,1070000.0
78,Industry,14/06/2017,MrNeeds,Consumer Internet,Micro Food Delivery platform,Noida,undisclosed investors,Seed Funding,500000.0
79,Industry,15/06/2017,MoneyTap,Consumer Internet,Money Lending platform,Bangalore,"Sequoia India, NEA, Prime Venture Partners",Private Equity,12300000.0
80,Industry,16/06/2017,Goodbox,eCommerce,Mobile SAAS  ECommerce platform for SMEs,Bangalore,"Nexus Venture Partners, Mekin Maheshwari",Private Equity,1000000.0
81,Industry,16/06/2017,Fincash,Consumer Internet,Personal Finance platform,Mumbai,"Mohammed Khan, Sameer Narayan & Others",Seed Funding,100000.0
82,Industry,16/06/2017,PortDesk,Others,Maritime Solutions,Noida,Alphard Maritime Group,Seed Funding,2000000.0
83,Industry,16/06/2017,EdgeFx,eCommerce,DIY project Kits seller,Hyderabad,"Cross Border Angels & Experts, Rajasthan Angel Innovators Network, The Chennai Angels",Seed Funding,1070000.0
84,Industry,16/06/2017,EazyDiner,Consumer Internet,Online Restaurant Reservation Platform,Gurgaon,YouWeCan Ventures,Seed Funding,1070000.0
85,Industry,16/06/2017,HealthIntel,Healthcare,Online Pharmacy,New Delhi,BLIP Initiatives,Seed Funding,1070000.0
86,Industry,19/06/2017,Unbxd,Others,Cloud-based product discovery platform,Bangalore,Eight Roads Ventures,Private Equity,12500000.0
87,Industry,19/06/2017,DarwinBox,Others,Enterprise human resources management platform,Hyderabad,"Lightspeed India Partners, Endiya Partners, 3one4 Capital Advisors LLP, Startupxseed Ventures LLP",Private Equity,4000000.0
88,Industry,20/06/2017,ForeverShop,Consumer Internet,Mobile based ecommerce platform,Bangalore,91maker.com,Seed Funding,300000.0
89,Industry,20/06/2017,Insider.in,Consumer Internet,Events Ticketing platform,Mumbai,Paytm,Private Equity,5200000.0
90,Industry,21/06/2017,Fynd,eCommerce,Fashion etailer,Mumbai,"IIFL Seed Ventures, Kae Capital, FJ Labs, Singularity Ventures, GrowX, Tracxn Labs, Axis Capital",Private Equity,2400000.0
91,Industry,21/06/2017,Grow Fit,Consumer Internet,Health-Tech platform,Bangalore,"Manipal Education and Medical Group (MEMG), SAR Group, The Grover Trust",Private Equity,4500000.0
92,Industry,21/06/2017,Fabulyst,Others,Artificial Intelligence based platform,Hyderabad,iBhubs,Seed Funding,215000.0
93,Industry,21/06/2017,mSwipe,Others,Point-of-Sale services,Mumbai,"UC-RNT Fund, Matrix Partners, alcon Edge Capital, DSG Consumer Partners",Private Equity,31000000.0
94,Industry,21/06/2017,OneAssist,Consumer Internet,Credit card fraud protection,Mumbai,Sequoia Capital,Private Equity,1070000.0
95,Industry,22/06/2017,Julia Computing,Others,Open Source Language for Data Science and Machine Learning,Bangalore,"General Catalyst, Founder Collective",Private Equity,4600000.0
96,Industry,22/06/2017,Kissht,Consumer Internet,Consumer Lending platform,Mumbai,"Endiya Partners, Ventureast",Private Equity,2000000.0
97,Industry,22/06/2017,Explore Life traveling,Consumer Internet,Local homes booking platform,Bangalore,"Mekin Maheshwari, Bharat Vijay, Krish Seshadri, Amar Arsikere",Seed Funding,500000.0
98,Industry,23/06/2017,Loantap,Consumer Internet,Lending platform for salaried professionals,Mumbai,"Kae Capital, India Quotient, IFMR, and MAS Financial Services Ltd",Private Equity,4000000.0
99,Industry,23/06/2017,Voxweb,Consumer Internet,Mobile based social networking platform,Mumbai,Undisclosed investors,Seed Funding,1000000.0
100,Industry,26/06/2017,HUG Innovations,Others,Gesture based  Smartwatch manufacturer,Hyderabad,"Mohit Srivastav, Kishore Ganji, Venkat Vallabhaneni, Rajeev Menon",Private Equity,5000000.0
101,Industry,26/06/2017,Flipkart,eCommerce,Online marketplace,Bangalore,Naspers,Private Equity,71000000.0
102,Industry,26/06/2017,V Resorts,Consumer Internet,Holiday & Vacation resort aggregator,Noida,"Seedfund, RB International",Private Equity,4000000.0
103,Industry,27/06/2017,Stashfin,Consumer Internet,Personal Finance App,New Delhi,"Snow Leopard Ventures, Alto Partners",Private Equity,5000000.0
104,Industry,27/06/2017,Formcept,Consumer Internet,Unified Data Analysis platform,Bangalore,Gujarat Venture Finance Ltd,Private Equity,1070000.0
105,Industry,27/06/2017,Spares Hub,eCommerce,Automobile parts marketplace,Pune,"The Chennai Angels, Anthill Scale Ventures, Esvee Technologies Inc, Inc95 Consulting",Seed Funding,311000.0
106,Industry,28/06/2017,FiTraQ,Consumer Internet,Fitness Centre Discovery Platform,New Delhi,"Aparup Sengupta, Devendra Reddy,",Seed Funding,1070000.0
107,Industry,28/06/2017,Rubique,Consumer Internet,Online Marketplace for financial products,Mumbai,"Kalaari Capital, Udayan Goyal",Private Equity,3000000.0
108,Industry,28/06/2017,Niki.ai,Consumer Internet,AI Based Personal Assistant,Bangalore,"SAP.iO, Unilazer Ventures",Private Equity,2000000.0
109,Industry,29/06/2017,Fitpass,Consumer Internet,Online Fitness Marketplace,New Delhi,"Abhinav Bindra, Gaurav Marya",Private Equity,1000000.0
110,Industry,29/06/2017,ZingHR,Others,"digital employee solutions,",Mumbai,Zeta,Private Equity,1070000.0
111,Industry,30/06/2017,Tagos Design,Others,in-video discovery platform,Bangalore,Undisclosed Investors,Private Equity,5000000.0
112,Industry,30/06/2017,UrbanClap,Consumer Internet,Mobile Services Marketplace,Gurgaon,"Vy Capital, SAIF Partners, Accel Partner, Bessemer Venture Partners",Private Equity,21000000.0
113,Industry,1/5/2017,Ace2three,Consumer Internet,Online Rummy playing Website,Hyderabad,Clairvest Group,Private Equity,73700000.0
114,Industry,1/5/2017,Power2SME,eCommerce,Buying portal for SMEs,Gurgaon,International Finance Corporation,Private Equity,10000000.0
115,Industry,2/5/2017,Innovapptive,Others,Enterprise Mobility Solutions,Hyderabad,Hyderabad Angels,Seed Funding,1500000.0
116,Industry,2/5/2017,4tigo,Others,Truck Network company,Bangalore,"Accel Partners, Nandan Nilekani,",Private Equity,10000000.0
117,Industry,2/5/2017,SMECorner,Consumer Internet,Online Platform for small business loans,Mumbai,Dutch government fund,Private Equity,1070000.0
118,Industry,2/5/2017,ZippServe,Consumer Internet,Real estate risk assessment platform,Bangalore,undisclosed investors,Seed Funding,390000.0
119,Industry,3/5/2017,Ola,Consumer Internet,Cab Aggregation App,Bangalore,"Falcon Edge Capital,  Capital Advisers",Private Equity,104500000.0
120,Industry,3/5/2017,Sumeru,Others,Software & Mobile development services,Bangalore,undisclosed investors,Seed Funding,1000000.0
121,Industry,4/5/2017,Healthians,Consumer Internet,Online Diagnostics and wellness platform,New Delhi,"Asuka Holdings, YouWeCan Ventures, Beenext, Beenos, M&S Partners",Private Equity,1070000.0
122,Industry,5/5/2017,HealthMir,Consumer Internet,AI-based health content platform,New Delhi,Nimit Panigrahi,Seed Funding,1070000.0
123,Industry,5/5/2017,Uactive,Consumer Internet,Health-based social networking & discovery App,Mumbai,Hinduja family,Seed Funding,1070000.0
124,Industry,5/5/2017,i-lend,Consumer Internet,Peer-to-peer lending platform,Hyderabad,50K Ventures,Seed Funding,1070000.0
125,Industry,5/5/2017,Good Methods Global,Others,Cloud Based Practice Management Software,Trivandrum,Accel Partners,Private Equity,1070000.0
126,Industry,5/5/2017,Balance App,Consumer Internet,Money Savings & Management App,Bangalore,Rainmatter,Seed Funding,233000.0
127,Industry,8/5/2017,YepMe,eCommerce,Private Label Fashion etailer,Gurgaon,"Rainbow Digital Services Pvt. Ltd, ILearnFinance Academy Pvt. Ltd.",Private Equity,700000.0
128,Industry,8/5/2017,Nightstay,Consumer Internet,Last minute hotel booking mobile app,New Delhi,"Indian Angels Network, LetsVenture",Seed Funding,1070000.0
129,Industry,8/5/2017,Devourin,Others,Restaurant Automation Solution,Pune,Deepak Nathani,Seed Funding,1070000.0
130,Industry,8/5/2017,MyGreens,Others,Cold-press Juices manufacturer,New Delhi,"Ajay Relan, LetsVenture",Seed Funding,1000000.0
131,Industry,8/5/2017,Ace Turtle,Others,Omni-Channel Platform,Bangalore,"Vertex Ventures, C31 Ventures",Private Equity,5000000.0
132,Industry,8/5/2017,CureFit,Others,Health-Tech Platform,Bangalore,"RNT Capital, Gokul Rajaram, Aditya Agarwal, Ruchi Sanghvi & others",Private Equity,3000000.0
133,Industry,9/5/2017,Curie Labs,Others,Energy Analytics startup,New Delhi,Satoshi Studios,Seed Funding,50000.0
134,Industry,9/5/2017,Uncanny Vision,Others,Computer Vision on Embedded Systems,Bangalore,Anand Chandrasekaran,Seed Funding,1070000.0
135,Industry,9/5/2017,Anchanto,Others,Ecommerce Fulfilment and Technology Platform,Pune,Luxasia Group,Private Equity,1070000.0
136,Industry,9/5/2017,Sequretek,Others,IT Security & Data Management Services,Mumbai,"GVFL, Unicorn India Ventures",Private Equity,1070000.0
137,Industry,10/5/2017,Lucideus,Others,Cyber Security Startup,New Delhi,"Vellayan Subbiah, Jonathan Boutelle, Rajan Anandan,  Rahul Chawla, Salil Donde, Amit Ranjan, Govind Rajan & Others",Seed Funding,1070000.0
138,Industry,10/5/2017,Vidooly,Consumer Internet,Video Intelligence platform,Noida,"Times Internet, GVFL",Private Equity,1400000.0
139,Industry,10/5/2017,Shopclues,eCommerce,Online marketplace,Gurgaon,InnoVen Capital,Private Equity,7700000.0
140,Industry,10/5/2017,Fourth Ambit,Consumer Internet,Community Building platform,Bangalore,1Crowd,Seed Funding,600000.0
141,Industry,10/5/2017,Chymera VR,Others,Advertising Platform for Virtual Reality,Bangalore,"Varsha Rao, Surojit Chatterjee, Nirav Choksi & Others",Seed Funding,1070000.0
142,Industry,11/5/2017,Early Salary,Consumer Internet,Online lending platform,Pune,"DG Ventures India, Dewan Housing Finance Corp",Private Equity,4000000.0
143,Industry,11/5/2017,Book My Diamond,eCommerce,Diamond B2B eTailer,Mumbai,Chirag Nikunj Sheth & Others,Seed Funding,1070000.0
144,Industry,11/5/2017,ION Energy,Others,Clean Tech Startup,Mumbai,"Aakrit Vaish, Swapan Rajdev, Sushill Jiwarajka",Seed Funding,1070000.0
145,Industry,12/5/2017,Legal Raasta,Consumer Internet,Legal Services to SMEs & Individuals,New Delhi,Impanix Capital,Private Equity,5000000.0
146,Industry,12/5/2017,Log 9 Materials,Others,NanoTech product developer,Bangalore,GEMs,Seed Funding,1070000.0
147,Industry,12/5/2017,Remit Guru,Consumer Internet,Digital money transfer platform,Mumbai,"Infibeam, CCavenue",Private Equity,466000.0
148,Industry,12/5/2017,Aequm,eCommerce,Cloud ECommerce platform,Bangalore,undisclosed investors,Seed Funding,1000000.0
149,Industry,15/05/2017,Zapty,Others,Project Management tool,Bangalore,IdeaSpring Capital,Seed Funding,500000.0
150,Industry,15/05/2017,Vernacular.ai,Others,Multi-lingual AI Platform for Businesses,Bangalore,Kstart Capital,Seed Funding,1070000.0
151,Industry,16/05/2017,Niki.ai,Others,AI-based chatbot,Bangalore,SAP,Private Equity,1070000.0
152,Industry,16/05/2017,Telr,Others,Online Payment Gateway,Mumbai,Innovations East,Private Equity,3000000.0
153,Industry,16/05/2017,Fynd,eCommerce,Fashion ECommerce Portal,Mumbai,Rocketship,Private Equity,500000.0
154,Industry,17/05/2017,Genie,Consumer Internet,hyperlocal delivery and logistics mobile app,Chennai,undisclosed investors,Seed Funding,250000.0
155,Industry,17/05/2017,Paysense,Consumer Internet,Online Lending platform,Mumbai,Jungle Ventures,Private Equity,5300000.0
156,Industry,18/05/2017,The Good Life,eCommerce,Online Luxury Tea etailer,Mumbai,"Ayesha Takia Azmi, Abu Farhan Azmi",Seed Funding,1000000.0
157,Industry,18/05/2017,PumpKart,eCommerce,Online Water Pumps etailer,Chandigarh,Dr. Ritesh Malik,Seed Funding,1070000.0
158,Industry,18/05/2017,Paytm,eCommerce,Mobile Wallet & ECommerce platform,Bangalore,SoftBank Group,Private Equity,1400000000.0
159,Industry,19/05/2017,EzCred,Consumer Internet,Consumer Lending Platform,Bangalore,"Dheeraj Pandey, Rajesh Yohannan, Akash Garg",Seed Funding,1000000.0
160,Industry,19/05/2017,HealthSutra,Others,Health Food Maker,Hyderabad,"Ankur Capital, Hyderabad Angels",Seed Funding,1070000.0
161,Industry,20/05/2017,YepMe,eCommerce,Private Fashion Brand etailer,New Delhi,Gokaldas Exports Ltd,Private Equity,1070000.0
162,Industry,22/05/2017,Delhivery,Others,ECommerce Logistics provider,New Delhi,Fosun International,Private Equity,30000000.0
163,Industry,22/05/2017,ZipGrid,Consumer Internet,"Cashless, paperless solutions for Housing societies",Mumbai,"JLL, 1Crowd",Seed Funding,500000.0
164,Industry,23/05/2017,TravelSpice,eCommerce,Travel ECommerce portal,Hyderabad,Eagle10 Ventures,Seed Funding,1070000.0
165,Industry,23/05/2017,Magicpin,Consumer Internet,Hyperlocal discovery platform,Gurgaon,"Lightspeed Venture Partners, Vy Capital,",Private Equity,6600000.0
166,Industry,23/05/2017,The Print,Consumer Internet,News Portal,New Delhi,"Ratan Tata, Nandan Nilekani, Uday Kotak, Vijay Shekhar Sharma, Kiran Mazumdar-Shaw, Rajiv C Mody",Seed Funding,1070000.0
167,Industry,23/05/2017,Box8,Consumer Internet,Food Delivery Platform,Mumbai,Trifecta Capital,Private Equity,1000000.0
168,Industry,24/05/2017,GenNext Students,Consumer Internet,Online Tutoring Services,Mumbai,Undisclosed Investors,Seed Funding,580000.0
169,Industry,25/05/2017,Aye Finance,Finance,Non-Banking Financial Company,Gurgaon,Blue Orchard,Private Equity,8000000.0
170,Industry,26/05/2017,WhatsLoan,Consumer Internet,Online Lending mobile app,Bangalore,Lahiri Music’s family office,Seed Funding,1070000.0
171,Industry,29/05/2017,Cube Consumer Services,Consumer Internet,Finance management Mobile app,Mumbai,,Seed Funding,1070000.0
172,Industry,29/05/2017,Nivesh,Consumer Internet,Online MF investment platform,Noida,"PV Sahad, Sandeep Shroff, Rahul Gupta",Seed Funding,1070000.0
173,Industry,29/05/2017,Wowflux,Others,image Processing solution,New Delhi,Undisclosed Investors,Seed Funding,1070000.0
174,Industry,29/05/2017,Collateral Medical,eCommerce,Online Medical equipment supplier,Mumbai,Carpediem Capital,Private Equity,3500000.0
175,Industry,30/05/2017,Loadshare,Others,Express Logistics Network,Bangalore,Matrix Partners,Seed Funding,1070000.0
176,Industry,30/05/2017,SimpliLend,Consumer Internet,Online lending platform,New Delhi,Undisclosed Investors,Seed Funding,1070000.0
