,Industry,Date,StartupName,IndustryVertical,SubVertical,CityLocation,InvestorsName,InvestmentType,AmountInUSD
1062,Industry,31/5/2016,Play Your Sport,Consumer Internet,Location based Sports & Fitness Discovery App,New Delhi,Ashish Gupta and other undisclosed investors,Seed Funding,1070000.0
1063,Industry,31/5/2016,Koovs,eCommerce,Apparel & Lifestyle eTailer,New Delhi,HT Media Ltd,Private Equity,4400000.0
1064,Industry,31/5/2016,CCavenue,Consumer Internet,Payment Gateway,Mumbai,NSI Infinium Global Pvt. Ltd,Private Equity,8900000.0
1065,Industry,31/5/2016,1mg,eCommerce,Online Pharmacy,Gurgaon,HBM Healthcare Investments,Private Equity,1070000.0
1066,Industry,31/5/2016,Tpot,Others,QSR Chain,Gurgaon,Ashish Gupta,Seed Funding,1070000.0
1067,Industry,31/5/2016,MachaDalo,Consumer Internet,Hyperlocal Advertising Platform,Mumbai,Undisclosed Investors,Seed Funding,175000.0
1068,Industry,1/4/2016,Dil Mil,Consumer Internet,Matchmaking Mobile App,SFO / Bangalore,"Nelstone Ventures, Transmedia Capital, Maiden Lane Ventures, CSC Upshot & Angel investors",Private Equity,2700000.0
1069,Industry,1/4/2016,PicsDream,Consumer Internet,Online Marketplace for Photographers,Delhi,Raman Roy,Seed Funding,1070000.0
1070,Industry,1/4/2016,Process 9,Consumer Internet,online translation and transliteration,Gurgaon,"Indian Angel Network, Alok Sharma, Kris Gopalakrishnan, Saurabh Srivastava, and Ajai Chowdhry",Seed Funding,1070000.0
1071,Industry,4/4/2016,Housing,Consumer Internet,Real Estate Portal,Mumbai,Vineet Singh,Private Equity,1070000.0
1072,Industry,4/4/2016,Roll Mafia,Others,Rolls & Biryanis QSR chain,Pune,Equentia Natural Resource & Other undisclosed investors,Seed Funding,1070000.0
1073,Industry,4/4/2016,Hungama,Consumer Internet,Digital Media Entertainment Portal,Mumbai,Xiaomi Inc,Private Equity,25000000.0
1074,Industry,4/4/2016,Highway Delite,Consumer Internet,Various Highway Help Services,Bangalore,N.S. Raghavan Centre for Entrepreneurial Learning,Seed Funding,1070000.0
1075,Industry,5/4/2016,Cult Fitness,Healthcare,Healthcare training programs,Bangalore,Mukesh Bansal,Seed Funding,1070000.0
1076,Industry,5/4/2016,Haptik,Others,Personal Assistant App,Mumbai,Times Internet Ltd,Private Equity,1070000.0
1077,Industry,5/4/2016,Servify,Consumer Internet,Gadget & Appliances Service App,Mumbai,"Blume Ventures, Barkawi Holdings GmbH, TM Service Technology Holdings GmbH",Private Equity,1070000.0
1078,Industry,6/4/2016,Shipsy,Others,Logistics Solutions,Gurgaon,DTDC Express Ltd,Private Equity,1000000.0
1079,Industry,6/4/2016,gear6,Consumer Internet,Online bike service and repairs platform,Bangalore,Ninestarter,Seed Funding,500000.0
1080,Industry,6/4/2016,MyGlamm,Consumer Internet,Mobile based on-demand Beauty Services platform,Mumbai,L’Occitane,Private Equity,6000000.0
1081,Industry,6/4/2016,Petoo,Consumer Internet,Online Food Delivery Platform,Bangalore,Axilor Ventures,Private Equity,1000000.0
1082,Industry,7/4/2016,Truly Social,Consumer Internet,Mobile Gaming Studio,London,Nazara Technologies Pvt Ltd,Private Equity,1070000.0
1083,Industry,8/4/2016,Little Black Book,Consumer Internet,"Curated Food, event & Lifestyle guide",New Delhi,"IDG, Indian Angel Network",Seed Funding,1070000.0
1084,Industry,8/4/2016,Vahan,Education,Mobile Education Platform,Chennai,Villgro,Seed Funding,1070000.0
1085,Industry,8/4/2016,imedilane,Consumer Internet,Online Health Diagnosis platform,New Delhi,"Mahendra Patel, Nilender Chauhan",Seed Funding,40000.0
1086,Industry,11/4/2016,Living Local,Consumer Internet,Social discovery platform,Mumbai,Rattan Chadha,Seed Funding,200000.0
1087,Industry,11/4/2016,Vegfru,eCommerce,Online Fruit & Vegetable Marketplace,New Delhi,Wingify,Seed Funding,1070000.0
1088,Industry,11/4/2016,Oyo,Consumer Internet,Online Branded Budget Room Booking Service,New Delhi,"Softbank, Sequoia Capital, Lightspeed Venture Partners, Greenoaks Capital, DSG Consumer Partners and Venture Nursery",Private Equity,100000000.0
1089,Industry,11/4/2016,PriceRaja,Consumer Internet,Price Comparison Portal,Gurgaon,Prashant Puri,Seed Funding,300000.0
1090,Industry,12/4/2016,MagicX,Consumer Internet,On-Demand Task Management App,Bangalore,"Kris Gopalakrishnan, Dr. Ranjan Pai",Seed Funding,1000000.0
1091,Industry,12/4/2016,Happydemic,Consumer Internet,Artist Discovery & Booking platform,Mumbai,Shaan,Seed Funding,1070000.0
1092,Industry,12/4/2016,LenDenClub,Finance,Peer-to-Peer Lending Platform,Mumbai,"Anirudh Damani, Daud Ali, Narendra Karnavat, Vikas Kapoor, Vikram Lakhotia, Krishna Jhunjhunwaala, Jayesh Shah",Seed Funding,1070000.0
1093,Industry,12/4/2016,Indi.com,Consumer Internet,Video Social Network,Bangalore,Anil Kapoor,Seed Funding,1070000.0
1094,Industry,13/04/2016,Legalraasta,Consumer Internet,Online legal Services for Startups,New Delhi,"Pravin Khandelwal, Yatin Kumar Jain",Seed Funding,1000000.0
1095,Industry,13/04/2016,RainCan,Consumer Internet,Subscription-based grocery delivery Mobile App,Pune,Dr. Aniruddha Malpani,Seed Funding,150000.0
1096,Industry,13/04/2016,Hippily,eCommerce,Fashion ECommerce App,Mumbai,"Dr. Sridhar Ramaswamy, Rakesh Mathur",Seed Funding,250000.0
1097,Industry,13/04/2016,kredX,eCommerce,Invoice discounting  Marketplace,Bangalore,"Prime Venture Partners,",Seed Funding,750000.0
1098,Industry,14/04/2016,Wedwise,Consumer Internet,Wedding related services community,New Delhi,StartUp Equity Partners,Seed Funding,1070000.0
1099,Industry,14/04/2016,BeaconsTalk,Others,contextual mobile advertising,Mumbai,"Rajeev Agrawal, Prashant Gooty",Seed Funding,100000.0
1100,Industry,15/04/2016,Deal 4Loans,Consumer Internet,Loan Comparison Portal,Noida,"Ram Shriram, Neeraj Arora, Puru Vashishtha",Seed Funding,1070000.0
1101,Industry,15/04/2016,RenewBuy,Consumer Internet,Online Car & Bike Insurance Comparison portal,New Delhi,Mount Nathan Advisors,Seed Funding,1000000.0
1102,Industry,15/04/2016,Blue Box Media,Consumer Internet,Online Tech Portals,Jaipur,"Mahavir Pratap Sharma, Ajay Data, Yogesh Chaudhary, Sanjay Phophaliya, Siddharth Agarwal, Kamal Kothari",Seed Funding,1070000.0
1103,Industry,15/04/2016,Vyomo,Consumer Internet,On-Demand Beauty Service provider,New Delhi,Naturals Salon Chain,Private Equity,15000000.0
1104,Industry,15/04/2016,Organicshop,eCommerce,Marketplace for organic products,Jaipur,"Vivek Nathani, Yogesh Chaudhary, Mahavir Pratap Sharma, Kamal Kothari, H C Jain",Seed Funding,1070000.0
1105,Industry,15/04/2016,MInd Your Fleet,Consumer Internet,Car Rental Software,Noida,Undisclosed Investors,Seed Funding,1070000.0
1106,Industry,15/04/2016,NestAway,Consumer Internet,Furnished Home Rental Platform,Bangalore,Tiger Global,Private Equity,30000000.0
1107,Industry,15/04/2016,Tapchief,Consumer Internet,Expert Advice Platform,Bangalore,Vijay Shekhar Sharma,Seed Funding,150000.0
1108,Industry,18/04/2016,Rapido,Consumer Internet,Bike Aggregator App,Bangalore,"Pawan Munjal, AdvantEdge Partners, Astarc Ventures",Private Equity,1070000.0
1109,Industry,18/04/2016,Yufta,eCommerce,Women’s Fashion ECommerce Portal,Bangalore,Ajay Data & other HNIs,Seed Funding,1070000.0
1110,Industry,18/04/2016,Smytten,eCommerce,Online Discovery and Shopping Platform,Gurgaon,Rajan Anandan,Seed Funding,1070000.0
1111,Industry,18/04/2016,Houssup,Consumer Internet,interior design and home furnishing portal,Jaipur,"Mitin Patel, Gaurav Agarwal",Seed Funding,1070000.0
1112,Industry,18/04/2016,Jugnoo,Consumer Internet,On-demand Delivery & Logistics platform,Chandigarh,Paytm & existing investors,Private Equity,10000000.0
1113,Industry,18/04/2016,Tork Motocycles,Others,Electric Motorcycle Manufacturer,Pune,"Bhavish Aggarwal, Ankit Bhati",Seed Funding,1070000.0
1114,Industry,19/04/2016,Betaout,eCommerce,customer intelligence and marketing automation platform,Noida,"Stanford Angels, LetsVenture, Chennai Angels, Hyderabad Angels, Mumbai Angels",Private Equity,1500000.0
1115,Industry,19/04/2016,DriversCart,Consumer Internet,on-demand chauffeur provider,Chennai,ah! Ventures,Seed Funding,450000.0
1116,Industry,19/04/2016,LensKart,eCommerce,Eyewear etailing platform,New Delhi,Ratan Tata,Private Equity,1070000.0
1117,Industry,19/04/2016,CollegeDekho,Consumer Internet,College & Student information platform,New Delhi,Man Capital,Private Equity,2000000.0
1118,Industry,19/04/2016,OYOfit,Consumer Internet,Fitness Services Aggregator platform,Bangalore,RN Agarwal,Seed Funding,1070000.0
1119,Industry,19/04/2016,Oliveboard,Consumer Internet,Online exam practice & preparation platform,Bangalore,India Educational Investment Fund,Private Equity,1070000.0
1120,Industry,19/04/2016,Simplilearn,Consumer Internet,Online certification platform,Bangalore,Brand Capital,Private Equity,1070000.0
1121,Industry,20/04/2016,1mg,eCommerce,Online Pharmacy,Gurgaon,"Maverick Capital Ventures, Sequoia Capital, Omidyar Network",Private Equity,15000000.0
1122,Industry,20/04/2016,Fashalot,Consumer Internet,Fashion and Store discovery mobile app,New Delhi,"YourNest Angel Fund, Rajul Garg",Seed Funding,1070000.0
1123,Industry,20/04/2016,Broomberg,Consumer Internet,Cleaning Services Provider,New Delhi,Undisclosed Angel investors & HNIs,Seed Funding,1070000.0
1124,Industry,21/04/2016,m.paani,Consumer Internet,Loyalty rewards platform,Mumbai,"Blume Ventures, Adil Allana, Aprameya Radhakrishna, Gautam Ivatury, Signal Point Partners",Seed Funding,1070000.0
1125,Industry,21/04/2016,Yufta,eCommerce,hyperlocal fashion retail platform,Jaipur,Ajay Data & undisclosed HNIs,Seed Funding,1070000.0
1126,Industry,21/04/2016,mishTag,Consumer Internet,"Style, Fashion Discovery Mobile app",New Delhi,"M&Y Partners, SVG Media, Anthil Ventures & others",Seed Funding,1070000.0
1127,Industry,21/04/2016,Advanced Structures India,Others,Automotive Design and Engineering company,Bangalore,GirnarSoft,Private Equity,1070000.0
1128,Industry,22/04/2016,Licious,eCommerce,Mobile based Meat ordering App,Bangalore,Mayfield India II Management Ltd,Private Equity,3000000.0
1129,Industry,22/04/2016,Knolskae,Consumer Internet,Educational Gamification & Simulation platform,Bangalore,"Inventus Capital Partners, HR Fund",Private Equity,1070000.0
1130,Industry,22/04/2016,Druva,Others,Converged Backup & Data Protection Solutions for Enterprises,Pune,"NTT Finance, Telephone Corporation",Private Equity,1070000.0
1131,Industry,22/04/2016,TOKO Innovation Studios,Consumer Internet,Children’s Entertainment Games & Products,New Delhi,Indian Angel network,Seed Funding,450000.0
1132,Industry,25/04/2016,Commut,Consumer Internet,Shuttle Service Provider,Hyderabad,50K Ventures,Seed Funding,200000.0
1133,Industry,25/04/2016,intouchapp,Consumer Internet,Contact Management Mobile App,Pune,Blume Ventures,Seed Funding,1070000.0
1134,Industry,25/04/2016,Dropkaffe,Others,Ready-to-Drink Beverage Producer,Bangalore,"GrowthStory, Apurva Salapuria, Hitesh Oberoi, Sidharth Pansari, Nirupa Shankar",Seed Funding,550000.0
1135,Industry,26/04/2016,Transerv,Consumer Internet,Digital Payments platform,Mumbai,"IDFC SPICE Fund, Micromax Informatics",Private Equity,15000000.0
1136,Industry,26/04/2016,ClearTax,Consumer Internet,Online filing of Tax returns,Bangalore,"Max Levchin, Scott Banister",Private Equity,1300000.0
1137,Industry,26/04/2016,Roposo,eCommerce,Social Fashion ECommerce Discovery platform,Gurgaon,Bertelsmann India Investments,Private Equity,15000000.0
1138,Industry,27/04/2016,MilkBasket,Consumer Internet,Micro Grocery Delivery Platform,Gurgaon,EVC Ventures,Seed Funding,500000.0
1139,Industry,27/04/2016,CareonGO,Consumer Internet,Online Pharmacy,Bangalore,"Farooq Oomerbhoy, Anupam Mittal, Anand Mittal, Ravi Garikipati, Vibhu Garg, Singapore Angel Network, Konglo Ventures",Seed Funding,1070000.0
1140,Industry,27/04/2016,RailYatri,Consumer Internet,Train Related Information portal,Noida,"Nandan Nilekani, Helion Ventures, Omidyar Networks, Blume Ventures",Private Equity,1070000.0
1141,Industry,27/04/2016,ICHR,Consumer Internet,Mobile based Children health Information app,New Delhi,Undisclosed,Seed Funding,450000.0
1142,Industry,27/04/2016,Murgency,Consumer Internet,Medical Emergency Response App,Mumbai,Axilor Ventures,Private Equity,1070000.0
1143,Industry,28/04/2016,The Wedding Brigade,Consumer Internet,Online Wedding Information Portal,Mumbai,Blume Ventures & Other unnamed Investors,Seed Funding,600000.0
1144,Industry,28/04/2016,DocsApp,Consumer Internet,Online Doctor Discovery & Chat platform,Bangalore,"Rebright Partners, Anand Rajaraman, Venky Harinarayan",Private Equity,1200000.0
1145,Industry,29/04/2016,Impact Guru,Consumer Internet,Online Crowdfunding platform for NGOs & Social Projects,Mumbai,"RB Investments, Fundnel",Seed Funding,500000.0
1146,Industry,29/04/2016,LetReach,eCommerce,ECommerce SAAS Solutions,New Delhi,vCommission,Private Equity,100000.0
1147,Industry,1/3/2016,DriveU,Consumer Internet,Chauffeurs Discovery for private car owners,Bangalore,Unitus Seed Fund,Seed Funding,1070000.0
1148,Industry,1/3/2016,Gympik,Consumer Internet,"Fitness Centres, Gym Discovery online marketplace",Bangalore,RoundGlass Partners,Private Equity,1070000.0
1149,Industry,1/3/2016,Testbook,Consumer Internet,Online Test Preparation Platform,Mumbai,S Chand & Co,Private Equity,1070000.0
1150,Industry,1/3/2016,IQlect,Others,Big Data Analytics Platform,Bangalore,"Lip-Bu Tan, Michael Marks, Nicolas Braithwaite",Private Equity,1070000.0
1151,Industry,2/3/2016,MoMark,Consumer Internet,Mobile Wallet Aggregation platform,Noida,YourNest Angel Fund,Private Equity,600000.0
1152,Industry,2/3/2016,Skedool,Consumer Internet,AI based Office Assistant Mobile App,Seattle / Bangalore,"Kludein LLCPhanindra Sama, Narayan Ramachandran, Pranav Pai",Seed Funding,1070000.0
1153,Industry,2/3/2016,Systemantics,Others,Industrial robots maker,Bangalore,"Nandan Nilekani, Accel Partners",Private Equity,1400000.0
1154,Industry,3/3/2016,Vertuals,Others,Audio Visual Digital Content creators for Brands,Mumbai,Dino Morea,Seed Funding,1070000.0
1155,Industry,3/3/2016,Imarticus Learning,Education,Financial Services & Analytics Education Institute,Mumbai,"Blinc Advisors, Amit Nanavati, Tashwinder Singh, Taranjit Jaswal, Amit Khanna",Private Equity,1000000.0
1156,Industry,3/3/2016,Shouut,Consumer Internet,Social Discovery Mobile app,New Delhi,Undisclosed investor,Seed Funding,500000.0
1157,Industry,4/3/2016,TinyStep,Consumer Internet,Parenting Social Network Platform,Bangalore,Matt Glickman,Private Equity,1070000.0
1158,Industry,4/3/2016,Aahaa,eCommerce,Office Products Super Store,Chennai,"YourNest Angel Fund,",Private Equity,1000000.0
1159,Industry,4/3/2016,Arcatron Mobility,Others,Smart wheelchair Design and Development,Pune,"Sudhir Mehta, Anoop Hingorani",Seed Funding,1070000.0
1160,Industry,4/3/2016,FTCash,Consumer Internet,Mobile Payments Platform,Kolkata,IvyCap Ventures,Seed Funding,150000.0
1161,Industry,4/3/2016,Civilsdaily,Consumer Internet,Civil Services News Aggregator,New Delhi,Manoj Kumar & Other undisclosed investors,Seed Funding,1070000.0
1162,Industry,4/3/2016,Zappka,Consumer Internet,Mobile App discovery and review platform,Gurgaon,"Daman Soni, Rajat Gupta & Others",Seed Funding,100000.0
1163,Industry,4/3/2016,Tarusa World,eCommerce,Handicraft products eTailer,Mumbai,Mohit Gulati,Seed Funding,1070000.0
1164,Industry,4/3/2016,medECUBE,Healthcare,Healthcare related Services provider,Gurgaon,Artiman Ventures,Private Equity,4000000.0
1165,Industry,7/3/2016,N.O.W,Consumer Internet,Bike Taxi Service & Hyperlocal Delivery App,Noida,"Ruchirans Jaipuria, Anuj Sanghi",Seed Funding,500000.0
1166,Industry,7/3/2016,Ninjacart,eCommerce,B2B marketplace for Farmers & Retailers,Bangalore,"Accel Partners, Qualcomm Ventures, M&S Partners, Zop Smart",Private Equity,3000000.0
1167,Industry,7/3/2016,Reach,Consumer Internet,Cross Platform P2P file sharing mobile app,Bangalore,"Rebright Partners, Sol Primero, Sudhir Anandarao, Ankur Warikoo, Ankur Singla",Seed Funding,500000.0
1168,Industry,7/3/2016,Vanity Cube,Consumer Internet,Hyperlocal Beauty Services platform,New Delhi,Unicorn Ventures,Seed Funding,250000.0
1169,Industry,7/3/2016,Wooplr,eCommerce,Curated Fashion ECommerce portal,Bangalore,"Naveen Tewari, Abhay Singhal, Amit Gupta, Piyush Shah, Raghunandan G, Rajiv Mehta",Seed Funding,1070000.0
1170,Industry,7/3/2016,Medidaili,Consumer Internet,Medical Support service platform,Bangalore,Undisclosed private investors,Seed Funding,100000.0
1171,Industry,8/3/2016,Finomena,Others,Credit Worthiness Big Data Analytics,New Delhi,Matrix Partners India,Private Equity,1070000.0
1172,Industry,8/3/2016,Cookaroo,Consumer Internet,Food Delivery Platform,Bangalore,Vijay Krishna Yadav,Seed Funding,1070000.0
1173,Industry,8/3/2016,vPhrase Analytics,Others,AI based data analytics platform,Mumbai,"Apoorv Ranjan Sharma, Daud Ali and others",Seed Funding,1070000.0
1174,Industry,8/3/2016,LoveCycles,Consumer Internet,Women’s health Tracker,Bangalore,Prime Venture Partners,Seed Funding,750000.0
1175,Industry,8/3/2016,Kartrocket,eCommerce,ECommerce SAAS platform,New Delhi,"Undisclosed Japanese investor, Bertelsmann India Investments, Nirvana Digital India Fund, Nirvana Digital Investment Holding Co Ltd, 500 Start-Ups",Private Equity,8000000.0
1176,Industry,8/3/2016,dunzo,Consumer Internet,Daily Task Management App,Bangalore,"Aspada Investment Advisors, Blume Ventures.",Seed Funding,650000.0
1177,Industry,9/3/2016,Indiamart,eCommerce,B2B Marketplace for SMBs,Noida,Amadeus Capital,Private Equity,1070000.0
1178,Industry,9/3/2016,SmartVizX,Others,Virtual Reality Solutions,Noida,"Indian Angel Network, Stanford Angels, Entrepreneurs India",Seed Funding,500000.0
1179,Industry,9/3/2016,MyGubbi,Others,Interior Design & Home Décor Solutions,Bangalore,"Vipul Parekh, ajesh K Murthy,",Seed Funding,2500000.0
1180,Industry,9/3/2016,Nukkad Shops,Consumer Internet,Hyperlocal Grocery Delivery Service,Hyderabad,PurpleTalk Inc,Seed Funding,1000000.0
1181,Industry,9/3/2016,Cloudacar,Consumer Internet,Carpooling Mobile App,Pune,"Amit Choudhary, Anuj Puri",Seed Funding,1070000.0
1182,Industry,9/3/2016,Justride,Consumer Internet,Self Drive Car Rental,Mumbai,Dheeraj Jain & Other angel investors,Seed Funding,400000.0
1183,Industry,9/3/2016,Yana,Consumer Internet,Personal AI Transaction Engine App,Gurgaon,"Puneet Gupta,",Seed Funding,1070000.0
1184,Industry,10/3/2016,Big Fish Ventures,Others,premium dining lounges Chain,New Delhi,Undisclosed investors,Private Equity,11100000.0
1185,Industry,10/3/2016,Stylflip,eCommerce,Pre-Owned Fashion marketplace mobile app,Mumbai,"Raj Gala Shah, Zaheer Memon",Seed Funding,1070000.0
1186,Industry,10/3/2016,Icertis,Others,Contract Management Software Solutions platform,Pune/Seattle,"Ignition Partners, Greycroft Partners, Fidelity Growth Partners India",Private Equity,15000000.0
1187,Industry,10/3/2016,Supplified,eCommerce,Construction material eTailer,New Delhi,Mohit Goel,Seed Funding,1000000.0
1188,Industry,11/3/2016,JollyFoodFellow,Others,Food Related Marketing & Branding platform,Ahmedabad,Janak Parikh,Seed Funding,1070000.0
1189,Industry,14/3/2016,PinkBlue,eCommerce,Medical Supplies eTailer,Bangalore,"Hari Krishna, Ajay Modani, Dr V Ravinder, Anirudh Rastogi, Abhishek Jain, Rakesh Gakhar, Rajeev Mudumba, Nagendra Prasad Bhanuprakash",Seed Funding,223608.0
1190,Industry,14/3/2016,TruckingCube,Others,"Domestic, Commercial, and Industrial Goods Movers",New Delhi,Agarwal Movers Group,Private Equity,14900000.0
1191,Industry,14/3/2016,eSwasthya,Consumer Internet,Online Medicine Delivery Aggregator,Ahmedabad,Hemang Sahani,Seed Funding,1070000.0
1192,Industry,15/3/2016,FlipClass,Consumer Internet,Tutor Search Platform,Bangalore,"S Chand and Co Pvt Ltd, Blume Ventures",Private Equity,1000000.0
1193,Industry,15/3/2016,Proximit,Others,Advertising Technology,Pune,Funding through 1Crowd platform,Seed Funding,150000.0
1194,Industry,15/3/2016,WithMe,Consumer Internet,Personalized Fashion App,Gurgaon,"Alex Kuruvilla, Pradeep Guha, Saket Dhankar, Rajan Pandhare",Seed Funding,250000.0
1195,Industry,16/3/2016,Gapoon,Consumer Internet,Hyperlocal Home Maintenance services,Bangalore,"Chandrashekar Tallapragada, Pankaj Kapoor",Seed Funding,180000.0
1196,Industry,16/3/2016,Avagmah,Consumer Internet,Online Education Portal,Bangalore,"Kris Gopalakrishnan, Atul Nishar",Seed Funding,1070000.0
1197,Industry,16/3/2016,WorkIndia,Consumer Internet,Online Job Board,Mumbai,Beenext,Seed Funding,1070000.0
1198,Industry,16/3/2016,Wealthy,Consumer Internet,Online Investment management portal,Bangalore,"Zishaan Hayath, Abhishek Goyal, Arjun and Rohan Malhotra, Harpreet Singh Grover, Gagan Dugal",Seed Funding,250000.0
1199,Industry,17/3/2016,Pramati,Healthcare,Specialized Patient Care platform,Noida,Undisclosed investors,Seed Funding,200000.0
1200,Industry,17/3/2016,Qlivery,Consumer Internet,Ondemand Concierge Service,Gurgaon,Swastika Company Ltd,Seed Funding,230000.0
1201,Industry,17/3/2016,HealthEnablr,Consumer Internet,Doctor Discovery and booking platform,Mumbai,Undisclosed investors,Seed Funding,800000.0
1202,Industry,17/3/2016,Liftiee,Consumer Internet,Car/ bike Pooling App,Mumbai,"Rannvijay Singh, Anita Hassanandani",Seed Funding,108000.0
1203,Industry,18/3/2016,Hello Curry,Others,Quick Service Restaurant Chain,Hyderabad,Sashi Reddi & Other unnamed investors,Private Equity,1500000.0
1204,Industry,19/3/2016,goSporto,Consumer Internet,Online Sports discovery and booking platform,New Delhi,Naveen Gupta,Seed Funding,30000.0
1205,Industry,21/3/2016,OneClickWash,Consumer Internet,Online Laundry & Washing service Booking & Delivery,Gurgaon,Unitus Seed Fund,Seed Funding,1070000.0
1206,Industry,21/3/2016,Girnar Software,Consumer Internet,Online News Media Network,Jaipur,Google Capital,Private Equity,1070000.0
1207,Industry,21/3/2016,Room On Call,Consumer Internet,Budget hotel aggregator,Gurgaon,CASHurDRIVE Marketing Pvt Ltd,Private Equity,2000000.0
1208,Industry,22/3/2016,Byju’s,Consumer Internet,Educational Video Content Creator,Bangalore,"Sequoia India, Sofina",Private Equity,75000000.0
1209,Industry,22/3/2016,BigBasket,eCommerce,Online Grocery Shop,Bangalore,Abraaj Group,Private Equity,150000000.0
1210,Industry,22/3/2016,DrivoJoy,Consumer Internet,On-demand 2-wheeler Servicing platform,Bangalore,"Indian Angel Network, Tracxn Labs & Others",Seed Funding,600000.0
1211,Industry,22/3/2016,Smartron,Others,Internet of Things Device manufacturer,Bangalore,Sachin Tendulkar,Private Equity,1070000.0
1212,Industry,22/3/2016,LifCare,Consumer Internet,Online Pharmacy portal,Jaipur,"Rajul Garg, Alok Mittal, Kunal Shah, Rishi Mandawat, Dheeraj Jain, Sandeep Tandon, Dexter Angel Circle",Seed Funding,1070000.0
1213,Industry,22/3/2016,CreditSeva,Consumer Internet,Online Credit management tools,Hyderabad,"Pix Vine Capital, Infocomm Development Authority of Singapore",Seed Funding,360000.0
1214,Industry,22/3/2016,CityShor,Consumer Internet,online lifestyle media recommendation portal,Ahmedabad,GAIN,Seed Funding,1070000.0
1215,Industry,23/3/2016,Endless Robotics,Others,Interior Painting Automation,Hyderabad,"Devidas Desai, Vipul Gautam, Singapore Angel Network",Seed Funding,100000.0
1216,Industry,23/3/2016,SP Robotics,Others,Robotic Classes for Students,Chennai,"Indian Angel Network,",Seed Funding,300000.0
1217,Industry,23/3/2016,StalkBuyLove,eCommerce,Fashion eTailer,New Delhi,"500 Startups, Littlerock, Singularity Ventures",Seed Funding,1070000.0
1218,Industry,23/3/2016,eKincare,Consumer Internet,Healthcare related solutions,Hyderabad,"BitChemy Ventures, Maheshwari Investments Pvt Ltd, Anshoo Gaur, Rama Krishna Reddy, Sandeep Seerapu",Private Equity,330000.0
1219,Industry,23/3/2016,HashLearn,Consumer Internet,Mobile based private tutoring services,Bangalore,"Bhavish Aggarwal, Binny Bansal,  Rajan Anandan, Mekin Maheshwar, Sunil Kalra, Anupam Mittal, Krishna Mehra, Singapore Angel Network",Seed Funding,1070000.0
1220,Industry,23/3/2016,Wheelstreet,Consumer Internet,Online Bike Rental platform,Bangalore,Broadbean Capital services,Private Equity,500000.0
1221,Industry,24/3/2016,Horntell,Consumer Internet,Unified Push Notification service,Gurgaon,"Bharanidharan Viswanathan, Sanjiv Mittal, Shobhit Shukla, Rahul Agarwal",Seed Funding,150000.0
1222,Industry,28/3/2016,Schoolkart,eCommerce,Online Marketplace for Schools,Noida,Undisclosed investors,Seed Funding,300000.0
1223,Industry,29/3/2016,HealthEminds,Consumer Internet,Online mental healthcare,Bangalore,Robin Utthappa,Seed Funding,1070000.0
1224,Industry,29/3/2016,Babygogo,Consumer Internet,Child healthcare experts aggregator mobile app,New Delhi,"Rajul Garg, Daljit Singh, Aditya Vij, Kishore Kumar, Shuchin Bajaj",Seed Funding,300000.0
1225,Industry,29/3/2016,Veritas Finance,Finance,Asset Based Lending platform,Chennai,Sarva Capital,Private Equity,4700000.0
1226,Industry,29/3/2016,QikShip,Consumer Internet,Mobile based Logistics provider,New Delhi,undisclosed investors,Seed Funding,200000.0
1227,Industry,29/3/2016,FixNix,Consumer Internet,GRC SAAS Platform,Chennai,Jay Vijayan,Seed Funding,500000.0
1228,Industry,30/3/2016,True Balance,Others,Mobile Balance Check App,Gurgaon,SoftBank Ventures Korea,Private Equity,1070000.0
1229,Industry,30/3/2016,Touchkin,Healthcare,Predictive Healthcare platform,Bangalore,"Alok Mittal, Amit Gupta, Anuj Srivastava, Himanshu Aggarwal, Raghunandan G, Puneet Agarwal",Seed Funding,400000.0
1230,Industry,31/3/2016,SwitchMe,Consumer Internet,Home Loan Rate comparison platform,Mumbai,"Mohandas Pai, Hiro Mashita, Singapore Angel Network, 500 Startups, Rajan Anandan, Ajay Sarupria",Seed Funding,1070000.0
1231,Industry,31/3/2016,Transcell,Healthcare,Family Stem Cell Banking Services,Hyderabad,Indian Angel Network,Seed Funding,1070000.0
1232,Industry,1/2/2016,Blue Tokai Coffee,eCommerce,Specialty Coffee Etailer,New Delhi,Snow Leopard Technology Ventures,Seed Funding,1070000.0
1233,Industry,2/2/2016,Altizone,Others,IoT & M2M Solutions,Pune,"Wipro Ventures,  Lumis Partners",Private Equity,4000000.0
